"Under One Roof (The STEMinist Novellas, #1)",Ali Hazelwood,"['Romance', ' Contemporary', ' Humor', ' Fiction']",3.68,129k ratings,"A scientist should never cohabitate with her annoyingly hot nemesis – it leads to combustion.Mara, Sadie, and Hannah are friends first, scientists always. Though their fields of study might take them to different corners of the world, they can all agree on this universal truth: when it comes to love and science, opposites attract and rivals make you burn….As an environmental engineer, Mara knows all about the delicate nature of ecosystems. They require balance. And leaving the thermostat alone. And not stealing someone else’s food. And other rules Liam, her detestable big-oil lawyer of a roommate, knows nothing about. Okay, sure, technically she’s the interloper. Liam was already entrenched in his aunt’s house like some glowering grumpy giant when Mara moved in, with his big muscles and kissable mouth just sitting there on the couch tempting respectable scientists to the dark side…but Helena was her mentor and Mara’s not about to move out and give up her inheritance without a fight.The problem is, living with someone means getting to know them. And the more Mara finds out about Liam, the harder it is to loathe him…and the easier it is to love him."
"Book of Night (Book of Night, #1)",Holly Black,"['Fantasy', ' Thriller', ' Mystery', ' Urban Fantasy']",3.55,53.5k ratings,"Holly Black makes her adult debut with Book of Night, a modern dark fantasy of shadowy thieves and secret societies.In Charlie Hall’s world, shadows can be altered, for entertainment and cosmetic preferences—but also to increase power and influence. You can alter someone’s feelings—and memories—but manipulating shadows has a cost, with the potential to take hours or days from your life. Your shadow holds all the parts of you that you want to keep hidden—a second self, standing just to your left, walking behind you into lit rooms. And sometimes, it has a life of its own.Charlie is a low-level con artist, working as a bartender while trying to distance herself from the powerful and dangerous underground world of shadow trading. She gets by doing odd jobs for her patrons and the naive new money in her town at the edge of the Berkshires. But when a terrible figure from her past returns, Charlie’s present life is thrown into chaos, and her future seems at best, unclear—and at worst, non-existent. Determined to survive, Charlie throws herself into a maelstrom of secrets and murder, setting her against a cast of doppelgängers, mercurial billionaires, shadow thieves, and her own sister—all desperate to control the magic of the shadows."
Something Wilder,Christina Lauren,"['Romance', ' Adventure', ' Contemporary', ' Comedy']",3.69,92.2k ratings,"Growing up the daughter of notorious treasure hunter and absentee father Duke Wilder left Lily without much patience for the profession… or much money in the bank. But Lily is nothing if not resourceful, and now uses Duke’s coveted hand-drawn maps to guide tourists on fake treasure hunts through the red rock canyons of Utah. It pays the bills but doesn’t leave enough to fulfill her dream of buying back the beloved ranch her father sold years ago, and definitely not enough to deal with the sight of the man she once loved walking back into her life with a motley crew of friends ready to hit the trails. Frankly, Lily would like to take him out into the wilderness—and leave him there.Leo Grady knew mirages were a thing in the desert, but they’d barely left civilization when the silhouette of his greatest regret comes into focus in the flickering light of the campfire. Ready to leave the past behind him, Leo wants nothing more than to reconnect with his first and only love. Unfortunately, Lily Wilder is all business, drawing a clear line in the sand: it’s never going to happen.  But when the trip goes horribly and hilariously wrong, the group wonders if maybe the legend of the hidden treasure wasn’t a gimmick after all. There’s a chance to right the wrongs—of Duke’s past and their own—but only if Leo and Lily can confront their history and work together. Alone under the stars in the isolated and dangerous mazes of the Canyonlands, Leo and Lily must decide whether they’ll risk their lives and hearts on the adventure of a lifetime."
I Kissed Shara Wheeler,Casey McQuiston,"[' Young Adult', ' Romance', ' Comedy', ' Mystery']",3.94,70.4k ratings,"From the New York Times bestselling author of One Last Stop and Red, White & Royal Blue comes a debut YA romantic comedy about chasing down what you want, only to find what you need...Chloe Green is so close to winning. After her moms moved her from SoCal to Alabama for high school, she’s spent the past four years dodging gossipy classmates and a puritanical administration at Willowgrove Christian Academy. The thing that’s kept her going: winning valedictorian. Her only rival: prom queen Shara Wheeler, the principal’s perfect progeny.But a month before graduation, Shara kisses Chloe and vanishes.On a furious hunt for answers, Chloe discovers she’s not the only one Shara kissed. There’s also Smith, Shara’s longtime quarterback sweetheart, and Rory, Shara’s bad boy neighbor with a crush. The three have nothing in common except Shara and the annoyingly cryptic notes she left behind, but together they must untangle Shara’s trail of clues and find her. It’ll be worth it, if Chloe can drag Shara back before graduation to beat her fair-and-square.Thrown into an unlikely alliance, chasing a ghost through parties, break-ins, puzzles, and secrets revealed on monogrammed stationery, Chloe starts to suspect there might be more to this small town than she thought. And maybe—probably not, but maybe—more to Shara, too.Fierce, funny, and frank, Casey McQuiston's I Kissed Shara Wheeler is about breaking the rules, getting messy, and finding love in unexpected places."
Family of Liars,E. Lockhart,"['Fiction', ' Mystery', ' Thriller', ' Contemporary']",3.79,65.6k ratings,"The prequel to We Were Liars takes readers back to the story of another summer, another generation, and the secrets that will haunt them for decades to come. A windswept private island off the coast of Massachusetts. A hungry ocean, churning with secrets and sorrow.A fiery, addicted heiress. An irresistible, unpredictable boy. A summer of unforgivable betrayal and terrible mistakes. Welcome back to the Sinclair family. They were always liars."
Trust,Hernan Diaz,"['Fiction', ' Historical Fiction', ' Mystery', ' Literary Fiction', ' Psychological Fiction']",3.87,51.6k ratings,"An unparalleled novel about money, power, intimacy, and perceptionEven through the roar and effervescence of the 1920s, everyone in New York has heard of Benjamin and Helen Rask. He is a legendary Wall Street tycoon; she is the daughter of eccentric aristocrats. Together, they have risen to the very top of a world of seemingly endless wealth—all as a decade of excess and speculation draws to an end. But at what cost have they acquired their immense fortune? This is the mystery at the center of Bonds, a successful 1937 novel that all of New York seems to have read. Yet there are other versions of this tale of privilege and deceit.Hernan Diaz’s TRUST elegantly puts these competing narratives into conversation with one another—and in tension with the perspective of one woman bent on disentangling fact from fiction. The result is a novel that spans over a century and becomes more exhilarating with each new revelation.At once an immersive story and a brilliant literary puzzle, TRUST engages the reader in a quest for the truth while confronting the deceptions that often live at the heart of personal relationships, the reality-warping force of capital, and the ease with which power can manipulate facts."
Book Lovers,Emily Henry,"['Fiction', ' Romance', ' Contemporary', ' Women's Fiction']",4.17,847k ratings,"One summer. Two rivals. A plot twist they didn't see coming....Nora Stephens’ life is books—she’s read them all—and she is not that type of heroine. Not the plucky one, not the laidback dream girl, and especially not the sweetheart. In fact, the only people Nora is a heroine for are her clients, for whom she lands enormous deals as a cutthroat literary agent, and her beloved little sister Libby.Which is why she agrees to go to Sunshine Falls, North Carolina for the month of August when Libby begs her for a sisters’ trip away—with visions of a small-town transformation for Nora, who she’s convinced needs to become the heroine in her own story. But instead of picnics in meadows, or run-ins with a handsome country doctor or bulging-forearmed bartender, Nora keeps bumping into Charlie Lastra, a bookish brooding editor from back in the city. It would be a meet-cute if not for the fact that they’ve met many times and it’s never been cute.If Nora knows she’s not an ideal heroine, Charlie knows he’s nobody’s hero, but as they are thrown together again and again—in a series of coincidences no editor worth their salt would allow—what they discover might just unravel the carefully crafted stories they’ve written about themselves."
You Made a Fool of Death with Your Beauty,Akwaeke Emezi,"['Fiction', ' Romance', ' Contemporary', ' LGBTQ+', ' Drama']",3.58,37.1k ratings,"New York Times bestselling author and National Book Award finalist Akwaeke Emezi (they/them) reimagines the love story in this fresh and seductive novel about a young woman seeking joy while healing from loss.Feyi Adekola wants to learn how to be alive again. It’s been five years since the accident that killed the love of her life and she’s almost a new person now—an artist with her own studio, and sharing a brownstone apartment with her ride-or-die best friend, Joy, who insists it’s time for Feyi to ease back into the dating scene. Feyi isn’t ready for anything serious, but a steamy encounter at a rooftop party cascades into a whirlwind summer she could have never imagined: a luxury trip to a tropical island, decadent meals in the glamorous home of a celebrity chef, and a major curator who wants to launch her art career. She’s even started dating the perfect guy, but their new relationship might be sabotaged before it has a chance by the dangerous thrill Feyi feels every time she locks eyes with the one person in the house who is most definitely off-limits. This new life she asked for just got a lot more complicated, and Feyi must begin her search for real answers. Who is she ready to become? Can she release her past and honor her grief while still embracing her future? And, of course, there’s the biggest question of all—how far is she willing to go for a second chance at love?Akwaeke Emezi’s vivid and passionate writing takes us deep into a world of possibility and healing, and the constant bravery of choosing love against all odds."
Elektra,Jennifer Saint,"['Fiction', ' Mythology', ' Drama', ' Historical Fiction']",3.71,29.2k ratings,"The House of Atreus is cursed. A bloodline tainted by a generational cycle of violence and vengeance. This is the story of three women, their fates inextricably tied to this curse, and the fickle nature of men and gods. Clytemnestra The sister of Helen, wife of Agamemnon - her hopes of averting the curse are dashed when her sister is taken to Troy by the feckless Paris. Her husband raises a great army against them, and determines to win, whatever the cost. Cassandra Princess of Troy, and cursed by Apollo to see the future but never to be believed when she speaks of it. She is powerless in her knowledge that the city will fall. Elektra The youngest daughter of Clytemnestra and Agamemnon, Elektra is horrified by the bloodletting of her kin. But, can she escape the curse, or is her own destiny also bound by violence?"
Never Lie,Freida McFadden,"['Thriller', ' Mystery', ' Suspense', ' Horror']",4.17,203k ratings,"Newlyweds Tricia and Ethan are searching for the house of their dreams.But when they visit the remote manor that once belonged to Dr. Adrienne Hale, a renowned psychiatrist who vanished without a trace four years earlier, a violent winter storm traps them at the estate… with no chance of escape until the blizzard comes to an end.In search of a book to keep her entertained until the snow abates, Tricia happens upon a secret room. One that contains audio transcripts from every single patient Dr. Hale has ever interviewed. As Tricia listens to the cassette tapes, she learns about the terrifying chain of events leading up to Dr. Hale’s mysterious disappearance.Tricia plays the tapes one by one, late into the night. With each one, another shocking piece of the puzzle falls into place, and Dr. Adrienne Hale’s web of lies slowly unravels.And then Tricia reaches the final cassette.The one that reveals the entire horrifying truth."
Fairy Tale,Stephen King,"['Fiction', ' Fantasy', ' Horror', ' Supernatural', ' Adventure']",4.14,172k ratings,"Legendary storyteller Stephen King goes deep into the well of his imagination in this spellbinding novel about a seventeen-year-old boy who inherits the keys to a parallel world where good and evil are at war, and the stakes could not be higher—for their world or ours. Charlie Reade looks like a regular high school kid, great at baseball and football, a decent student. But he carries a heavy load. His mom was killed in a hit-and-run accident when he was ten, and grief drove his dad to drink. Charlie learned how to take care of himself—and his dad. Then, when Charlie is seventeen, he meets Howard Bowditch, a recluse with a big dog in a big house at the top of a big hill. In the backyard is a locked shed from which strange sounds emerge, as if some creature is trying to escape. When Mr. Bowditch dies, he leaves Charlie the house, a massive amount of gold, a cassette tape telling a story that is impossible to believe, and a responsibility far too massive for a boy to shoulder. Because within the shed is a portal to another world—one whose denizens are in peril and whose monstrous leaders may destroy their own world, and ours. In this parallel universe, where two moons race across the sky, and the grand towers of a sprawling palace pierce the clouds, there are exiled princesses and princes who suffer horrific punishments; there are dungeons; there are games in which men and women must fight each other to the death for the amusement of the “Fair One.” And there is a magic sundial that can turn back time. A story as old as myth, and as startling and iconic as the rest of King’s work, Fairy Tale is about an ordinary guy forced into the hero’s role by circumstance, and it is both spectacularly suspenseful and satisfying."
"The American Roommate Experiment (Spanish Love Deception, #2)",Elena  Armas,"['Romance', ' Contemporary', ' Fiction', ' Romantic Comedy']",3.87,151k ratings,"From the author of the Goodreads Choice Award winner The Spanish Love Deception, the eagerly anticipated follow-up featuring Rosie Graham and Lucas Martín, who are forced to share a New York apartment.Rosie Graham has a problem. A few, actually. She just quit her well paid job to focus on her secret career as a romance writer. She hasn’t told her family and now has terrible writer’s block. Then, the ceiling of her New York apartment literally crumbles on her. Luckily she has her best friend Lina’s spare key while she’s out of town. But Rosie doesn’t know that Lina has already lent her apartment to her cousin Lucas, who Rosie has been stalking—for lack of a better word—on Instagram for the last few months. Lucas seems intent on coming to her rescue like a Spanish knight in shining armor. Only this one strolls around the place in a towel, has a distracting grin, and an irresistible accent. Oh, and he cooks.Lucas offers to let Rosie stay with him, at least until she can find some affordable temporary housing. And then he proposes an outrageous experiment to bring back her literary muse and meet her deadline: He’ll take her on a series of experimental dates meant to jump-start her romantic inspiration. Rosie has nothing to lose. Her silly, online crush is totally under control—but Lucas’s time in New York has an expiration date, and six weeks may not be enough, for either her or her deadline."
The Marriage Portrait,Maggie O'Farrell,"['Fiction', ' Historical Fiction', ' Renaissance Fiction', ' Historical Romance']",4.04,96.3k ratings,"Alternate cover edition of ISBN 9780593320624.The author of award-winning Hamnet brings the world of Renaissance Italy to jewel-bright life in this unforgettable fictional portrait of the captivating young duchess Lucrezia de’ Medici as she makes her way in a troubled court.Florence, the 1550s. Lucrezia, third daughter of the grand duke, is comfortable with her obscure place in the palazzo: free to wonder at its treasures, observe its clandestine workings, and devote herself to her own artistic pursuits. But when her older sister dies on the eve of her wedding to the ruler of Ferrara, Modena and Reggio, Lucrezia is thrust unwittingly into the limelight: the duke is quick to request her hand in marriage, and her father just as quick to accept on her behalf. Having barely left girlhood behind, Lucrezia must now enter an unfamiliar court whose customs are opaque and where her arrival is not universally welcomed. Perhaps most mystifying of all is her new husband himself, Alfonso. Is he the playful sophisticate he appeared to be before their wedding, the aesthete happiest in the company of artists and musicians, or the ruthless politician before whom even his formidable sisters seem to tremble? As Lucrezia sits in constricting finery for a painting intended to preserve her image for centuries to come, one thing becomes worryingly clear. In the court’s eyes, she has one duty: to provide the heir who will shore up the future of the Ferranese dynasty. Until then, for all of her rank and nobility, the new duchess’s future hangs entirely in the balance. Full of the beauty and emotion with which she illuminated the Shakespearean canvas of Hamnet, Maggie O’Farrell turns her talents to Renaissance Italy in an extraordinary portrait of a resilient young woman’s battle for her very survival."
"When in Rome (When in Rome, #1)",Sarah Adams,"['Romance', ' Contemporary', ' Fiction.']",3.94,61.8k ratings,"Opposites certainly attract for the stranded pop star and small-town baker in this charming slice of romance from the author of the TikTok sensation The Cheat Sheet.Amelia Rose, known as Rae Rose to her adoring fans, is burned-out from years of maintaining her ""princess of pop"" image. Inspired by her favorite Audrey Hepburn film, Roman Holiday, she drives off in the middle of the night for a break in Rome . . . Rome, Kentucky, that is.When Noah Walker finds Amelia on his front lawn in her broken-down car, he makes it clear he doesn't have the time or patience for celebrity problems. He's too busy running the pie shop his grandmother left him and reminding his nosy but lovable neighbors to mind their own damn business. Despite his better judgment, he lets her stay in his guest room--but only until her car is fixed--then she's on her own.Then Noah starts to see a different side of Rae Rose--she's Amelia: kindhearted and goofy, yet lonely from years in the public eye. He can't help but get close to her. Soon she'll have to return to her glamorous life on tour, but until then, Noah will show Amelia all the charming small-town experiences she's been missing, and she'll help him open his heart to more.Amelia can't resist falling for the cozy town and her grumpy tour guide, but even Audrey had to leave Rome eventually."
Killers of a Certain Age,Deanna Raybourn,"['Fiction', ' Thriller', ' Action', ' Suspense', ' Crime']",3.88,68.6k ratings,"Older women often feel invisible, but sometimes that's their secret weapon.They've spent their lives as the deadliest assassins in a clandestine international organization, but now that they're sixty years old, four women friends can't just retire - it's kill or be killed in this action-packed thriller.Billie, Mary Alice, Helen, and Natalie have worked for the Museum, an elite network of assassins, for forty years. Now their talents are considered old-school and no one appreciates what they have to offer in an age that relies more on technology than people skills.When the foursome is sent on an all-expenses paid vacation to mark their retirement, they are targeted by one of their own. Only the Board, the top-level members of the Museum, can order the termination of field agents, and the women realize they've been marked for death.Now to get out alive they have to turn against their own organization, relying on experience and each other to get the job done, knowing that working together is the secret to their survival. They're about to teach the Board what it really means to be a woman--and a killer--of a certain age."
"The Ballad of Never After (Once Upon a Broken Heart, #2)",Stephanie Garber,"['Fiction',  'Fantasy', 'Romance', 'Young Adult']",4.56,91k ratings,"Not every love is meant to be.After Jacks, the Prince of Hearts, betrays her, Evangeline Fox swears she'll never trust him again. Now that she’s discovered her own magic, Evangeline believes she can use it to restore the chance at happily ever after that Jacks stole away.But when a new terrifying curse is revealed, Evangeline finds herself entering into a tenuous partnership with the Prince of Hearts again. Only this time, the rules have changed. Jacks isn’t the only force Evangeline needs to be wary of. In fact, he might be the only one she can trust, despite her desire to despise him.Instead of a love spell wreaking havoc on Evangeline’s life, a murderous spell has been cast. To break it, Evangeline and Jacks will have to do battle with old friends, new foes, and a magic that plays with heads and hearts. Evangeline has always trusted her heart, but this time she’s not sure she can..."
"The Bullet That Missed (Thursday Murder Club, #3)",Richard Osman,"['Mystery', ' Thriller', ' Crime', ' Suspense']",4.41,118k ratings,"One Thursday afternoon in the seniors' center, a decade-old cold case --their favorite kind-- leads the Thursday Murder Club to a local news legend and a murder with no body and no answers. A new foe they call ""Viking"", wants Elizabeth to kill former KGB chief Viktor, or he will kill her sweet best friend Joyce. Activist marked for death Ron and psychiatrist Ibrahim chase clues for Viking's identity, and investigate mob-queen prisoner from last book.This third adventure ranges from a prison cell with espresso machine to a luxury penthouse with swimming pool high in the sky."
"Kingdom of the Feared (Kingdom of the Wicked, #3)",Kerri Maniscalco,"['Fiction', ' Fantasy', ' Romance', ' Paranormal', ' Young Adult']",3.89,73.1k ratings,"Emilia is reeling from the shocking discovery that her twin sister, Vittoria, is alive. But before she faces the demons of her past, Emilia yearns to claim her king, the seductive Prince of Wrath, in the flesh. Emilia doesn’t simply desire his body, she wants his heart and soul—but that’s something the enigmatic demon can’t promise her.When a high-ranking member of House Greed is assassinated, Emilia and Wrath are drawn to the rival demon court. Damning evidence points to Vittoria as the murderer and she’s quickly declared an enemy of the Seven Circles. Despite her betrayal, Emilia will do anything to solve this new mystery and find out who her sister really is.Together Emilia and Wrath play a sin-fueled game of deception as they work to stop the unrest that’s brewing between witches, demons, shape-shifters and the most treacherous foes of all: the Feared.Emilia was warned that when it came to the Wicked nothing was as it seemed. But, have the true villains been much closer all along? When the truth is finally revealed, it just might end up costing Emilia her heart.Two curses.One prophecy.A reckoning all have feared.And a love more powerful than fate. All hail the king and queen of Hell.From the #1 New York Times bestselling author of the Stalking the Jack the Ripper series comes the steamy conclusion to Kingdom of the Wicked trilogy."
"The Winners (Beartown, #3)",Fredrik Backman,"['Fiction', ' Drama', ' Contemporary', ' Sports', ' Coming-of-age', ' Mystery', ' Romance']",4.47,83k ratings,"Two years have passed since the events that no one wants to think about. Everyone has tried to move on, but there’s something about this place that prevents it. The residents continue to grapple with life’s big questions: What is a family? What is a community? And what, if anything, are we willing to sacrifice in order to protect them?As the locals of Beartown struggle to overcome the past, great change is on the horizon. Someone is coming home after a long time away. Someone will be laid to rest. Someone will fall in love, someone will try to fix their marriage, and someone will do anything to save their children. Someone will submit to hate, someone will fight, and someone will grab a gun and walk towards the ice rink.So what are the residents of Beartown willing to sacrifice for their home?"
